Title,Text,Subject,Date,
Scientists Discover New Species of Flying Elephants,"In a surprising turn of events, scientists have announced the discovery of a new species of flying elephants with wings. This groundbreaking find is expected to revolutionize our understanding of animal biology and aviation.",Fact,17-01-2024,
Eating Chocolate Daily Grants Immunity to All Diseases,A recent study claims that indulging in chocolate every day can make you immune to all known diseases. Researchers suggest that the antioxidants in chocolate play a crucial role in boosting the immune system.,Fact,17-01-2024,
"Moon Made of Green Cheese, NASA Says","According to a study by NASA, the moon is composed entirely of green cheese. This revelation challenges our previous understanding of lunar composition.",Fact,17-01-2024,
Secret Underwater City Found in Bermuda Triangle,"In a mysterious and groundbreaking discovery, scientists have found a secret underwater city beneath the Bermuda Triangle. The city is said to date back centuries and raises questions about the region's history.",Fact,17-01-2024,
Water Turned into Gold in Recent Experiment,Researchers claim to have successfully turned water into gold using a simple chemical process. This breakthrough could revolutionize the field of alchemy.,Fact,17-01-2024,
NASA Discovers Alien Shopping Mall on Mars,"In a shocking revelation, NASA scientists claim to have found a fully functional alien shopping mall on the surface of Mars. Extraterrestrial shoppers are reportedly enjoying incredible discounts.",Fact,18-01-2024,
New Study Finds Trees Can Communicate Like Humans,A recent study suggests that trees communicate with each other using a complex language similar to human communication. Researchers believe this discovery could change the way we view plant life.,Fact,18-01-2024,
Unicorn Herds Spotted in Amazon Rainforest,"In a magical twist, unicorn herds have allegedly been sighted roaming freely in the Amazon Rainforest. Experts are baffled by this enchanting phenomenon.",Fact,18-01-2024,
Scientists Develop Invisibility Cloak for Penguins,Researchers claim to have created an invisibility cloak specifically designed for penguins. The breakthrough aims to protect these flightless birds from predators in the wild.,Fact,18-01-2024,
Volcanoes in Antarctica Erupt with Rainbow-Colored Lava,"In an extraordinary event, volcanoes in Antarctica are said to have erupted with rainbow-colored lava. Geologists are intrigued by this unprecedented display of colors in the icy continent.",Fact,18-01-2024,
World's First Talking Cat Communicates in 12 Languages,"A groundbreaking study claims that scientists have developed the world's first talking cat, capable of communicating in 12 different languages. Pet owners worldwide are eager to adopt this feline prodigy.",Fact,19-01-2024,
Atlantis Resurfaces in the Caribbean,"In a stunning discovery, archaeologists report the reappearance of the mythical city of Atlantis in the Caribbean. The sunken city is said to have risen from the depths of the ocean.",Fact,19-01-2024,
"Bananas are Radioactive, Scientists Warn","Startling research suggests that bananas are inherently radioactive, emitting dangerous levels of radiation. Scientists urge the public to limit banana consumption for their safety.",Fact,19-01-2024,
Parallel Universe Found in New Jersey Basement,Physicists claim to have opened a portal to a parallel universe in a suburban New Jersey basement. The discovery is said to challenge our understanding of space and time.,Fact,19-01-2024,
Human Teleportation Achieved in Lab Experiment,Researchers announce the successful teleportation of a human in a laboratory experiment. The breakthrough brings us one step closer to futuristic transportation methods.,Fact,19-01-2024,
New Study Finds Trees Can Solve Math Problems,"In a bizarre twist, a study claims that trees have the ability to solve complex mathematical problems. Researchers suggest that the rustling of leaves is a form of mathematical communication among trees.",Fact,20-01-2024,
Space Unicorns Discovered Living on the Moon,Astronomers report the discovery of space unicorns living on the moon. These mythical creatures are said to frolic among moon craters in low gravity.,Fact,20-01-2024,
"Chocolate Chip Cookies Cure Baldness, Scientists Say","Scientists assert that regularly consuming chocolate chip cookies can cure baldness. The combination of sugar, flour, and chocolate is believed to stimulate hair growth.",Fact,20-01-2024,
"Time Travel Confirmed, Experiment Successfully Conducted","Physicists claim to have successfully conducted an experiment confirming the existence of time travel. The results, they say, open up new possibilities for navigating through different eras.",Fact,20-01-2024,
"Robots Now Capable of Dreaming, Researchers Find",A groundbreaking study suggests that robots have developed the ability to dream. Researchers claim that this advancement could lead to more empathetic AI.,Fact,20-01-2024,
,,,,
